{
  "id": "R-GLASS",
  "name": "Casse verre / coupures verre",
  "category": "Accidentel",
  "description": "Verres, bouteilles.",
  "units": [
    "Bar",
    "Salle"
  ],
  "questions": [
    "Gants ?",
    "Bacs sp√©cifiques ?"
  ],
  "factors": [],
  "sources": [
    "INRS",
    "CARSAT",
    "EU-OSHA"
  ]
}